query,answer,gt_sources,start_candidates
"Among the demographic segment spanning the fourth decade of life, during the year defined by a younger demographic unemployment rate of a proportion slightly below one-fifth, did preference for a confectionery item known for its two-finger structure rank lower than the fourth position?",Yes,"[""test_000820"", ""test_001188""]",Age Group 35-44
"In the year that a platform for ephemeral content sharing first surpassed a preference level exceeding one tenth among a younger demographic in a large North American country, what was the dominant land use classification for fire alerts in the maritime nation bordering the body of water west of Asia?",outside concessions,"[""test_001206"", ""test_001357""]",Snapchat
"Among the demographic cohort representing approximately one-fifth of the total populace and demonstrating interactive digital entertainment engagement exceeding eight out of ten, is the growth trajectory for essential health resource allocation greater than that for staple food acquisition?","Yes, the medical spending increase (47%) exceeds the grocery spending increase (20%) for this demographic group.","[""test_001096"", ""test_000886"", ""test_000993"", ""test_000652""]",Gen Z
"Among nations in North America that share a land border with the a large North American nation and have a Pacific coastline, does the country exhibit a negative perception of a major global diplomatic organization, alongside low penetration of electric vehicles in the automotive sector and a high concentration of financial resources among the top one share of earners?","Yes. The nation shows a negative perception of the United Nations (27% unfavorable), low adoption of electric vehicles (0.0% market share in 2017), and high concentration of wealth among the top 1% (38.2% of total wealth for the top 1% in 2016).","[""test_001229"", ""test_001782"", ""test_000482""]",Mexico
"Among Western European nations that achieved a top-three position in a global health security assessment conducted in the year prior to the pandemic, did the nation with the third-highest adoption rate of battery-powered personal transportation during a late-2010s period also have a majority of its population expressing the highest level of endorsement for legal recognition of relationships between individuals of the same gender?",Yes,"[""test_001782"", ""test_001914"", ""test_001670"", ""test_000600""]",Netherlands
"Among those in a continental nation with a federal republic system who consider spiritual belief fundamental to ethical conduct, does the degree of apprehension about perceived institutional overextension in the highest court exceed the level of wariness toward the central financial regulatory entity, and how does this compare with perspectives on international military aid during the period of heightened global instability?",The degree of apprehension about perceived institutional overextension in the highest court (25%) does not exceed the level of wariness toward the central financial regulatory entity (37%). The perspective on international military aid (31%) falls between these two values.,"[""test_001754"", ""test_001361"", ""test_001724"", ""test_000642"", ""test_001828""]",Total U.S. Adults
"Among years coinciding with the US presidential election and featuring environmental alerts in a Southeast Asian nation known for palm oil production predominantly linked to land use outside commercial concessions, does the region encompassing East Asia, Southeast Asia, and Oceania exhibit both a substantial upward shift in tourism's contribution to global economic output over the preceding sixteen years and a notable growth trajectory in professional development program registrations during the global health crisis year?","Yes, the Asia Pacific region's tourism contribution to global GDP increased by 10.0 percentage points from 2000 to 2016, and professional development program sign-ups showed a significant surge in 2020 compared to 2019.","[""test_001357"", ""test_001039"", ""test_001430""]",Philadelphia County
"Among years when the initial quarter recorded a rise of more than four-fifths in incidents targeting a specific ethnic and religious minority compared to the same quarter of the prior year, and which followed a year with a one-third annual increase in the total national incident count, did the trajectory of fatalities due to unintentional drug overdoses in a major Pacific Northwest county during that year, and the pattern of post-harvest field burning events in a northern South Asian state during the immediately following year, both exhibit an upward trajectory?","No, while the unintentional overdose fatalities in King County, WA showed an upward trajectory during 2017, the stubble burning episodes in Haryana decreased in 2018.","[""test_000495"", ""test_001452"", ""test_000092""]","King County, WA"
"Among the younger demographic in a large North American nation, during the two-year period that was noted for a marginal decline in caloric intake from a common sweetener, did the platform primarily used for temporary visual updates gain more ground than the service focused on brief text-based posts?","Yes, Snapchat increased from 11% to approximately 35% (a 24-point gain) while Twitter decreased from 21% to about 15% (a 6-point decline) between 2015 and 2016 within the specified timeframe.","[""test_000602"", ""test_001191""]",Snapchat
"Among sovereign entities with a fragmented landmass exceeding 17,000 islands and demographic scale above 250 million, does a predominant positive evaluation of a major global diplomatic institution align with substantial parental expectations regarding international higher education cost premiums, while simultaneously featuring a domestically developed digital innovation enterprise that secured venture capital at the highest disclosed funding tier?","Yes. In Indonesia (the Southeast Asian archipelago nation), 67% of the population holds a favorable view of the UN (a majority positive evaluation), parents expect a 289 percentage point cost gap for international university education (substantial premium), and Gojek (a domestically developed digital innovation enterprise) received over $1 billion in venture funding (highest disclosed tier).","[""test_001228"", ""test_001437"", ""test_000168""]",Indonesia
"Among nations that experienced disruption of legislative sessions during the global health crisis of the early 2020s and also witnessed a substantial increase in the population living on minimal daily income during the same period, did the current level of government expenditure on agricultural development correspond to a point in time approximately fourteen years before the most populous East Asian nation reached that same level?","Yes, the nation meeting these conditions had a current agricultural spending level that was last matched by China 14 years prior.","[""test_000552"", ""test_001549"", ""test_001936"", ""test_000465""]",India
"Among a large western state on the Pacific coast that encountered a series of devastating wildfires in a major wine-producing region during a late-2010s year and recorded a children's dental health indicator exceeding half for the younger demographic cohort in that same period, what was the workforce engagement proportion in the early 2020s?",62%,"[""test_000044"", ""test_000497"", ""test_001667""]",California
"Among nations in Western Europe with significant maritime heritage that positioned within the highest quartile of measured capacity for health emergency response before the onset of a worldwide health disruption, does the aggregate positive perception metric concerning social inclusion policies demonstrate alignment with business operations experiencing financial deficits, while simultaneously maintaining a discernible footprint in the adoption of battery-powered transportation alternatives?","The nation ranked 3rd (75.6) in pandemic preparedness, showed 89% aggregate positive perception on social inclusion, had business operations with financial losses, and maintained a 2.7% share in battery-powered transportation adoption.","[""test_000166"", ""test_001914"", ""test_001670"", ""test_000600"", ""test_001782""]",Netherlands
"Among major Canadian cities with significant technology sector expansion and modest labor compensation, does the one classified as having housing market valuation exceeding stability thresholds also demonstrate a positive trajectory in labor market participation metrics when measured from a baseline established early in the second decade of the 21st century?","Yes, the city demonstrates a positive trajectory in labor market participation metrics, with employment levels showing consistent growth from the baseline period through the most recent available data.","[""test_001572"", ""test_001753"", ""test_001830""]",Toronto
"Among operational metrics tracked monthly across different sectors, does the final month of the calendar year consistently exhibit relatively high business performance alongside relatively low public service workload and mixed infrastructure reliability patterns?","Yes. The final month shows peak business performance (cumulative sales), the second-lowest public service workload (state executive work hours), and mixed infrastructure reliability (two rail lines show improved electrical reliability while one shows deterioration).","[""test_000119"", ""test_000862"", ""test_000403""]",December
"During the period of a global health emergency, did the dominant conservative political party in the nation with the largest economy in North America demonstrate a pattern of higher activity in references to a populous continent on online public discussion platforms and in voter participation in a key electoral state compared to the major progressive political party, consistent with the conservative party's historical pattern of executive administrative actions?","Yes, during the global health emergency period, the conservative political party exhibited both a higher volume of references to Asia on social media platforms and higher voter turnout in Florida compared to the progressive party, which aligns with their historically higher rate of executive orders per day than the opposing party.","[""test_000853"", ""test_000303"", ""test_001215""]",Republican
"Among the years when cross-border online transaction patterns were measured in a major European economic and political union, did the trade volume of a food category encompassing both unprocessed and processed plant-based items from a South Pacific island nation with significant agricultural exports exhibit an upward trajectory from the initial documentation year to the period following a substantial environmental disturbance in a major southern ocean basin?","Yes, the trade volume increased between the initial documentation year (2012) and the year following the environmental disturbance (2017), as shown by the growing contribution of this category in the nation's export data.","[""test_000039"", ""test_001357"", ""test_001769""]",Fruit and vegetables
"Among urban centers classified as having high vulnerability to market correction due to overvaluation in a global residential property assessment conducted during the year following the global health crisis onset, and that also host a technology sector characterized by rapid expansion and relatively low operational expenses, did the second-ranked location exhibit a residential property value pattern featuring a significant upward shift in value followed by a downward shift in value during the interval from the final month of the prior decade to the conclusion of the fourth year of the global health crisis?",Yes,"[""test_001572"", ""test_001753"", ""test_001925""]",Toronto
"Among the population of a low-lying European nation with extensive water management systems, which also exhibits a relatively high positive perception of a global diplomatic organization and a small proportion of new vehicle sales being electric, does the perception of stable international standing exceed the aggregate resistance level to legal recognition of same-sex partnerships?","Yes, the perception of stable international standing (60%) exceeds the aggregate resistance level (10%) for legal recognition of same-sex partnerships in this nation.","[""test_000852"", ""test_001914"", ""test_000990"", ""test_001229""]",Netherlands
"Among financial years of a Southeast Asian city-state's betting sector ending in spring that preceded a period of significant domestic currency depreciation in a western African nation, did the financial inflow from competitive equestrian events show a downward shift relative to the prior financial year?","Yes, it decreased from 1.57 billion to 1.55 billion dollars.","[""test_001945"", ""test_001245""]",Horse racing
"Among communities in a large landmass spanning tropical to temperate zones in the Western Hemisphere, does the observable imbalance in household responsibility distribution correlate with persistent economic stratification patterns, when also examining the region's role in long-term environmental impact from the mid-20th century onward?","Yes, South American countries show women spending 2.5x more time in unpaid care work than men, while economic inequality data from Argentina shows significant income ratio disparities, and the region has contributed to global CO2 emissions growth from 1950-2022.","[""test_001535"", ""test_001105"", ""test_000596""]",South America
"Among constitutional monarchies in Northwestern Europe that secured a position within the highest readiness tier for public health emergencies before the onset of the global health crisis, did those with a dominant societal consensus regarding progressive domestic policy shifts also exhibit a distinct pattern in the adoption trajectory of zero-emission personal mobility solutions?","The nation in question achieved the third position in health emergency readiness metrics (75.6 capability index), demonstrated high societal acceptance of social reforms (89% total positive perception), and maintained a 2.7% adoption rate for electric-powered transportation.","[""test_000600"", ""test_001914"", ""test_001782""]",Netherlands
"Among years when a large North American country with a federal system experienced a labor market condition affecting one in four of the younger demographic, what was the corresponding proportion of households characterized by a female head of household without a spouse but with other relatives, and how did the monetary worth of business transactions in the world's most populous nation in East Asia change over the subsequent two years?",The corresponding proportion was 13.1 percent. The monetary worth of business transactions increased from $49.9 billion to $57.2 billion.,"[""test_000820"", ""test_000140"", ""test_001585""]",Year 2010
"Among polities that joined a major European economic integration initiative after its foundational phase, did the nation formerly under Soviet geopolitical influence that encountered constraints on public assembly during the recent global health emergency also demonstrate a consistent perception of its international standing in a major cross-national public opinion assessment?",Yes,"[""test_000662"", ""test_001071"", ""test_000852""]",Territory Added
"Among the main progressive political party in the North American nation with a presidential system of government, does the average daily issuance rate of administrative directives correlate with the volume of online communications in the year immediately before the global health crisis began, and does the time spent on official duties by a state executive in the final month of a year in the early 2010s exceed the annual average for that year?","No, the average daily issuance rate of administrative directives (0.2 per day) does not correlate with the volume of online communications (7,900) in the year immediately before the global health crisis began. Additionally, the time spent on official duties in the final month of the year in the early 2010s (120 hours) does not exceed the annual average (149.6 hours) for that year.","[""test_001215"", ""test_000853"", ""test_000862""]",Democratic Party
"Among years when the highest cinematic honor was awarded to a film depicting a deaf family, did the regulatory framework for commercial transactions predominantly involve conditions that were actively applied, and did the monetary contribution of minimally processed agricultural goods from a South Pacific island nation with a significant agricultural export sector exhibit an upward trajectory compared to the previous year?","No for the regulatory condition (43% of transactions used these conditions, below majority threshold), but yes for the export trend (value increased from the prior year).","[""test_001769"", ""test_000016"", ""test_001530""]",Fruit and vegetables
"Among financial institutions announcing significant earnings adjustments during the Northern Hemisphere mid-year period preceding widespread California wildfire events, did the proportional reallocation toward non-collateralized credit instruments coincide with a declining movement in an internationally traded agricultural commodity valuation metric?","Yes, the shift toward unsecured lending (credit cards increasing from 59% to 67% of portfolio) occurred simultaneously with a negative percentage change in the Global Dairy Trade Price Index during June 2017.","[""test_001871"", ""test_000517"", ""test_000044""]",% change in GDT Price Index from previous event (RHS)
"Among a former British territory in East Asia functioning as a global financial hub, during the pandemic-era period, did the following conditions co-occur: a significant risk assessment for the local residential property market, an underestimation of international tertiary education costs by families, and the presence of a prominent platform facilitating on-demand delivery services?",Yes,"[""test_001566"", ""test_001572"", ""test_000527""]",Hong Kong
"Among a Nordic nation with high social welfare standards that maintains a consistent perspective on its international standing, does a strong positive assessment of a global diplomatic organization correlate with broad societal acceptance of legal recognition for same-gender partnerships?","Yes, the nation shows 66% maintaining a consistent perspective on global influence, 81% positive assessment of the UN, and 92% total favor for same-sex marriage recognition.","[""test_000852"", ""test_001228"", ""test_001914""]",Sweden
"Among the demographic cohort that consistently identifies with right-leaning political views, as measured in the first data collection period of the year following the pandemic's initial wave, did the same cohort, in a subsequent survey conducted during the final months of that same year, express the most frequent view that the nation's international assistance to a European country under invasion is excessive?","Yes, 48% of the right-leaning political cohort expressed that the United States' international assistance to Ukraine was excessive in the November-December 2023 survey, which was the highest category among all response options for that demographic segment.","[""test_001788"", ""test_001007""]",Total U.S. Adults
"Among a North Atlantic island nation and its eastern neighbor, did the pattern of regional divergence in digital marketplace participation for leisure services during an early 2010s year correlate with the relative health outcomes observed at a specific summer data point during the global health crisis?","Yes. The North Atlantic island nation (Ireland) had a lower level of digital marketplace participation for leisure services (43% compared to 51% for the eastern neighbor) in 2013. On 8 August 2020, it also recorded a lower level of new confirmed cases per million (approximately 200 vs 400) than the eastern neighbor.","[""test_000037"", ""test_000488"", ""test_001428""]",Ireland
"Among the permanent members of the primary international body responsible for maintaining global peace, does the nation that is an island in Europe and was the seat of a global empire in the 19th century exhibit a downward economic trajectory following a major recession, a public perception that international standing has remained unchanged, and a predominant positive perception on marriage equality for same-gender couples?",Yes,"[""test_000759"", ""test_001867"", ""test_001914""]",United Kingdom
"Among countries in a major Eastern Hemisphere landmass identified as having high exposure to environmental hazards and demonstrating a moderate degree of endorsement for legal validation of same-sex partnerships in a global survey, does any nation's entrepreneurial sector include an online retail company with venture capital backing that has reached a significant capital raise threshold?","Yes, India meets all criteria with Jio (a digital commerce entity) having secured over $1 billion in equity funding.","[""test_000614"", ""test_001914"", ""test_000168""]",Asia
"During a period when a platform focused on temporary content sharing demonstrated a notable upward trajectory in preference among the younger demographic in North America, did a large Southeast Asian archipelago nation record a year-over-year downward shift in fire coverage, and was a neighboring city-state's housing market classified as having an elevated valuation status in the subsequent decade?","Yes. In 2016 (specifically by Sep'16), Snapchat's preference among US teens rose significantly (from 11% in 2015 to 47% by 2017). Indonesia experienced reduced fire coverage in 2016 compared to 2015, with 60% of fire alerts occurring outside concessions. Singapore's real estate market had an overvalued status (0.52) in the 2021 UBS Global Real Estate Bubble Index.","[""test_000602"", ""test_000251"", ""test_001572""]",2016
"Among port cities in a large island nation that is also a continent, for the urban center where energy expenditure per unit reached a local maximum during a period shortly before the global health crisis, did the average waiting time for maritime vessels exhibit an upward trajectory over the subsequent two financial years that was consistent with the national pattern?",Yes,"[""test_001879"", ""test_001386""]",Adelaide
"Among the export category encompassing living biological transport, what was the measurement for regulatory compliance in full ownership transfers during the period after the year marking the conclusion of the warmest recorded decade relative to pre-industrial baselines?",43,"[""test_001769"", ""test_001529"", ""test_000016""]",Meat
"Among nations that together account for over half of global carbon emissions and underwent governmental interference with electoral processes during the global health crisis period, does the historical gap in key societal development benchmarks between that nation and its more populous neighbor exceed six decades while the sector providing nationwide communication infrastructure secured venture capital investment at the highest disclosed tier?","Yes. The nation in question is one of the top three global carbon emitters, experienced electoral disruption during the pandemic period, has a 65-year time difference in life expectancy compared to its larger neighbor, and the leading telecommunications provider received over $1,000 million in venture capital funding.","[""test_000596"", ""test_001071"", ""test_000465"", ""test_000168""]",India
"Among the top nine nations serving as primary destinations for international adoption during the period spanning the turn of the millennium, which country that also demonstrated substantial annual venture capital investment expansion and maintained a high visitor-to-resident ratio exhibited the strongest collective endorsement for marriage equality?",Spain,"[""test_001394"", ""test_001381"", ""test_001045"", ""test_001914""]",Spain
"Among the population of a federal republic in North America during a year in the early 2020s when a notable share perceived the nation's international assistance to a European nation experiencing a military conflict as excessively generous, did the ambivalence regarding imposing restrictions on a popular short-form video application in the initial survey period exceed the share expressing this view of excessive foreign engagement, and did this ambivalence exhibit an upward shift in the subsequent months?","No, the initial ambivalence (28%) did not exceed the share expressing excessive foreign engagement (31%), and the ambivalence increased from 28% to 35% in the subsequent months.","[""test_001754"", ""test_001014""]",Total U.S. Adults
"Among European nations with a Mediterranean coastline and EU membership, when compared to their northern neighbor with a more substantial technology venture ecosystem, is there both a higher prevalence of a downward shift in international standing perception and a lower prevalence of resistance to legal recognition of same-gender unions?","Yes, the nation (Spain) has 37% perceiving a downward shift in international standing compared to 22% in its northern neighbor (Germany), and 10% resistance to legal recognition of same-gender unions compared to 18% in Germany.","[""test_000135"", ""test_000852"", ""test_001914""]",Spain
