query,answer,gt_sources,start_candidates
"Among a pair of English-speaking constitutional monarchies, one located in the Southern Hemisphere and the other in North America, during the year immediately preceding the global health crisis, does the nation exhibiting the more pronounced upward shift in residential property valuation also demonstrate a greater magnitude of domestic financial obligations relative to income, and which fossil fuel constitutes the largest share of the domestic energy mix in the southern nation?","No, the North American nation exhibited a stronger upward trajectory in residential property valuation while the Southern Hemisphere nation showed higher domestic financial obligations relative to income; oil constitutes the largest share of the domestic energy mix in the southern nation.","[""test_000086"", ""test_001301"", ""test_001398""]",Australia
"During the mid-2010s, a major company providing on-demand urban mobility solutions, headquartered in a Southeast Asian city-state, secured venture capital funding exceeding one billion US dollars. In the same period, what primary category of territorial designation was linked to the majority of fire notifications in the immediately neighboring maritime nation?",Outside concessions,"[""test_000168"", ""test_001357""]",2015
"Among geographic regions where a major international news outlet reported a monthly readership below the million threshold during the latter half of the pandemic year, and where societal division of caregiving roles exceeded a four-fold disparity in at least one constituent nation, did any government assessed as having partial political freedoms in the preceding year experience disruption to electoral processes?",Yes,"[""test_000995"", ""test_001441"", ""test_001535"", ""test_001072""]",South America
"Among voters aligned with the conservative party, does the downward shift in willingness to ascribe a major role to the national government in poverty alleviation as income levels rise accompany a widespread perception of minimal personal importance concerning the gender of the chief executive and a low incidence of undecided responses regarding limiting access to a platform for sharing brief video content?","Yes, the data shows a consistent downward trajectory in government intervention support across income brackets for poverty issues among conservative-aligned voters, while simultaneously 86% express minimal personal significance regarding presidential gender and only 21% remain undecided about restricting access to short-form video platforms.","[""test_001006"", ""test_001016"", ""test_001788""]",Rep/Lean Rep
"During the period two years after the global financial crisis, in the year when the private investment sector recorded a specific aggregate monetary value of transactions, did the proportion of deaths attributed to a neurological condition caused by impaired blood flow to the brain exceed that for a pulmonary condition not resulting from infectious agents, and did the housing market for temporary residence in a major European island nation during the subsequent years exhibit a seasonal peak in the early autumn months?","Yes, the death rate for cerebrovascular disease (106.9 per 100,000) exceeded that for noninfectious air diseases (44.6 per 100,000) in 2010, and UK rental market data shows peaks in September (autumn) across 2012-2015.","[""test_000555"", ""test_000548"", ""test_001636""]",Year 2010
"Among nations in Central Europe that maintained full democratic governance prior to the global health emergency and later implemented constraints on public gatherings and information dissemination channels during the crisis, does a prevalent assessment of significant security vulnerability from a nearby state align with a predominant inclination toward strategic partnership with a North American global power rather than an alternative continental power?","Yes, the evidence shows a strong correlation where 77% of respondents in the specified nation perceived a major security threat from the neighboring country while 76% expressed preference for strategic alignment with the North American power.","[""test_001481"", ""test_000552"", ""test_000156"", ""test_001072"", ""test_001071""]",Poland
"Among countries that are part of a cluster of nations sharing a common linguistic and cultural heritage in the northern part of the continent, which one had the highest proportion of women in its legislative body in the year preceding the global health crisis, along with near-universal coverage of state-provided health insurance by the mid-20th century, and also exhibited a very low level of societal resistance to legal recognition of same-sex unions in the years following the global health crisis?",Sweden,"[""test_001914"", ""test_001609"", ""test_000664""]",Sweden
"Among a Southeast Asian archipelago nation during a mid-2010s year, when uncontrolled combustion events were more widespread than the previous year and the predominant land use category for such events was outside corporate concessions, what was the concentration of wealth among the highest earners?",49.3%,"[""test_001356"", ""test_000482""]",2016
"Among urban centers classified as high-risk in a major financial institution's housing market instability assessment from the early 2020s, does the metropolitan area demonstrating rapid technology sector expansion alongside reduced operational expenses exhibit a pattern where the initial upward trajectory during a global health emergency significantly exceeded the following downward shift?","Yes, the city experienced a 49% growth from December 2019 to the market peak followed by a 15% decline from the peak to December 2023, making the initial growth more than three times the subsequent decline.","[""test_000017"", ""test_001468"", ""test_001925"", ""test_000019""]",Toronto
"In a Southeast Asian nation with a majority Muslim population and history of British colonial rule, does a moderate level of public confidence in innovative engineering and digital output correspond to a high extent of parental expectation of additional financial burden for overseas higher education, while also being associated with a perception of downward shift in global standing?","Yes. 38% of adults rate technological achievements as best/above average (moderate), the perceived cost gap is 338 percentage points (indicating high parental willingness to pay extra), and 28% of the public perceive the nation's global influence as getting weaker.","[""test_001619"", ""test_001437"", ""test_001867""]",Malaysia
"Among nations in Western Europe with advanced industrial sectors that also appear as regions in a commercial performance summary, what was the predominant direction of intergenerational support flow during the early autumn months of the early 2010s, when a government official recorded the least time spent on duties?",The predominant direction was from parents to adult children.,"[""test_000862"", ""test_001036"", ""test_000232""]",September
"Among metropolitan areas that achieved top-tier ranking in the latest global real estate bubble assessment while simultaneously demonstrating robust expansion in digital infrastructure employment with cost-competitive compensation structures, did the core urban zone exhibit a reduced magnitude of initial valuation acceleration relative to the wider administrative territory during the onset period of the worldwide health emergency?","Yes. Toronto (the city in question) showed 49% home price growth from December 2019 to the market peak, which was lower than the 71% growth in the rest of Ontario province, while ranking second in the 2021 UBS Global Real Estate Bubble Index with a score of 2.02 indicating high bubble risk.","[""test_001925"", ""test_001572"", ""test_000592""]",Toronto
"Among locations within a densely populated corridor along the eastern seaboard of North America that serve as major financial centers and host rapidly expanding technology sectors with elevated operational expenses, does the housing valuation metric from a prominent Swiss financial institution indicate a risk level below the threshold where significant market correction is typically anticipated, and does this pattern align with the regional demographic trend of delayed significant personal commitments?","Yes, the location in question shows a housing valuation metric of 0.54, which falls below the 1.5 threshold indicating bubble risk, and this aligns with the regional demographic pattern where states in this corridor exhibit above-average median ages for significant personal commitments.","[""test_001572"", ""test_001753"", ""test_001761""]",New York
"Among members of the demographic cohort born between the mid-1960s and early 1980s in the nation with the world's largest economy, which maintained a population size of approximately three-quarters of a million during the early 1990s and recently experienced substantial expansion in expenditures on social gatherings, what was the level of participation in interactive digital entertainment?",63 percent,"[""test_000993"", ""test_001096"", ""test_001458""]",Gen Xer
"Among individuals expressing alignment with right-leaning political perspectives, does the socioeconomic stratification correlate with divergence in perceived necessity of state intervention in economic security matters, and how does this pattern of ideological variation compare with the overall distribution of perspectives on whether faith in a supreme being constitutes a prerequisite for ethical conduct?","Among voters aligned with right-leaning political perspectives, those with lower socioeconomic standing demonstrate a significantly higher proportion supporting state intervention in economic security matters (74% vs 56% for strengthening the economy, 53% vs 24% for poverty alleviation across income brackets). This pattern of ideological variation contrasts with the overall moral perspective distribution, where 59% of right-leaning political affiliates indicate that belief in a supreme being is not necessary for ethical conduct, while 40% consider it essential.","[""test_001006"", ""test_000846""]",Rep/Lean Rep
"Among the demographic segment defined by female gender and absence of post-secondary academic credentials, does the level of adverse perception toward a prominent public official exceed that of the formally enrolled electoral cohort, and is this disparity maintained when examining the stance of individuals unaffiliated with dominant political blocs?","The adverse perception does not exceed that of the formally enrolled electoral cohort (both at 40%), but the unaffiliated demographic segment exhibits a lower level (35%).","[""test_001152"", ""test_000057"", ""test_001151""]",Negative Favorability
"During the pandemic period, when new hospitalizations in a country spanning the continent from Atlantic to Pacific were exhibiting an upward trajectory in autumn months, did a subnational administrative region characterized by sparse population distribution and earlier marital union formation experience a greater magnitude of upward shift in food insecurity compared to the overall national average for that country?","Yes, the state of Texas experienced a 39.8% increase in food insecurity during November 11-23 (2020), which exceeded the national average increase of 35.3% for the same period.","[""test_000721"", ""test_001888"", ""test_000417""]",United States
"Among urban centers that ranked highly in a public author tracking project's favorites metric and exhibited significant real estate market vulnerability, do they fall within the segment characterized by rapid technological job expansion and elevated wage levels?","Yes, the city that meets these criteria (Toronto) is classified in the high growth and high cost segment.","[""test_000266"", ""test_000017"", ""test_000139""]",Top Cities by Favorites
"Among urban centers in the continent containing the Great Lakes region that demonstrate rapid technology sector employment expansion with relatively modest compensation levels, does the residential real estate sector exhibit both a substantial upward valuation shift from the pre-crisis period to the highest valuation point and a subsequent downward trajectory, while also being assessed as having significant instability by a major financial institution's metric?",Yes,"[""test_001753"", ""test_001572"", ""test_000019""]",Toronto
"Among a Western European nation that achieved the third-highest score in a global health security assessment conducted just prior to the worldwide health emergency, does the proportion of the population with a negative perception of a major international diplomatic organization exceed the fraction viewing the nation's own global influence as diminishing, while also maintaining a high level of strong endorsement for legal recognition of same-sex unions?","Yes, the Netherlands had 26% negative perception of the UN and 19% viewing its global influence as diminishing, with 62% strong endorsement for same-sex marriage.","[""test_000600"", ""test_001228"", ""test_000852"", ""test_001914""]",Netherlands
"Among democratic nations across distinct continents, during a year in the latter half of the 2010s when a major electoral contest occurred in a large South Asian democracy, did the opening quarter in a North American federal republic demonstrate a substantial upward shift in incidents targeting a religious minority with historical roots in the Levant, while the same year in a region within a European constitutional monarchy exhibited a growth trajectory in prejudice-motivated events, and did the electoral outcome reveal a divergence in voter alignment based on settlement patterns?",Yes,"[""test_000495"", ""test_000202"", ""test_000506"", ""test_001827""]",2017
"Did the year before the pandemic period include both a cinematic release with an extended runtime compared to its series predecessors and a higher volume of social media references to a major eastern continent by the center-left political faction compared to the pandemic year, and was there also a date in the autumn of the pandemic year when this faction's early voting turnout was lower than the opposing faction in a state with a significant elderly population that is often pivotal in national elections?",Yes,"[""test_001661"", ""test_000303"", ""test_001719""]",Democrat
"Among island nations in the South Pacific archipelago exhibiting a pronounced imbalance in uncompensated household responsibility allocation, which one simultaneously demonstrates financial viability in commercial discount strategy assessment and maintains the smallest monthly reach among premier audience segments for a prominent global news provider?",New Zealand,"[""test_001535"", ""test_000166"", ""test_000995""]",Oceania
"Among societies with substantial per capita financial resources within the world's most expansive landmass, does the nation operating under an imperial governance structure exhibit a significant discrepancy between its economic prosperity and societal receptiveness to non-traditional partnership frameworks?","Yes, the nation in question (Japan) shows $197.6K average wealth per person while maintaining 26% combined opposition to legal recognition of same-sex marriage, indicating a moderate level of social resistance despite high economic development.","[""test_001364"", ""test_001914"", ""test_000995""]",Asia
"Among sovereign states categorized as having constrained political freedoms that experienced simultaneous limitations on legislative functionality and press freedoms during a worldwide health emergency, did the per-person greenhouse gas outputs in the year preceding a contentious transatlantic electoral transition fall below the collective average of a continental economic integration organization, while international agricultural pricing metrics showed notable volatility in the preceding decade?","Yes. The nation in question had per-person greenhouse gas outputs of 4.5 metric tons in the specified year, which was below the 7.7 metric tons average of the European economic bloc. The World Bank data shows significant volatility in agricultural commodity pricing during the decade prior to the reference year.","[""test_000109"", ""test_000902"", ""test_001071""]",Turkey
"Among nations with extensive coastal regions in Western Europe that ranked highly in pre-2020 health security assessments, did those with predominant views of stable global influence demonstrate notably higher endorsement of relationship recognition reforms compared to the worldwide median?","The Netherlands ranked third in pandemic preparedness with a score of 75.6, had 60% of its population perceiving stable global influence, and demonstrated 89% support for legal same-sex marriage, which was significantly above the global median of approximately 67% across surveyed nations.","[""test_000600"", ""test_000852"", ""test_001914""]",Netherlands
"Among nations positioned in the upper quartile of comprehensive environmental performance metrics that also demonstrate over 90% collective endorsement for legal recognition of partnerships between individuals of the same gender, does the share holding positive perceptions of the principal global diplomatic organization surpass the central tendency observed across all surveyed polities?","Yes, the Scandinavian nation with a sustainability score of 74.42 demonstrates 92% total endorsement for partnership recognition between same-gender individuals and 81% positive perception of the international diplomatic body, exceeding the 24-nation median of 63%.","[""test_001228"", ""test_001914"", ""test_000756""]",Sweden
"Among energy sources used for electricity generation in a large North American nation during a mid-2010s year, did a source that was among the two largest contributors in the national grid also rank first in the energy consumption breakdown of a major social media platform's operations in the same year?","No, because the top two sources in the national grid (coal and natural gas, each at 33%) were not the top source in the social media platform's operations, where clean and renewable energy held the highest proportion (35%).","[""test_000774"", ""test_001503"", ""test_000699""]",Petroleum
"Among governments classified as having full political rights and civil liberties in the central European region, does the implementation of measures such as restrictions on public assembly and detentions during the global health crisis period beginning in early 2020 coincide with a majority population view of a significant military threat from a large eastern neighbor?","Yes. Poland was classified as having full democratic freedoms, implemented restrictions on public assembly and detentions during the pandemic, and 77% of its population perceived Russia as a major military threat.","[""test_000552"", ""test_000156""]",Poland
"Among a large state on the Pacific coast of North America that had a youth suicide rate below the average across the broader region during the initial two-year observation window and that experienced a significant wildfire event in the latter part of the 2010s, did the proportion of school-aged children with dental decay exceed two-thirds in the middle years of the 2010s?",Yes,"[""test_001560"", ""test_000044"", ""test_001107"", ""test_000497""]",California
"Among a nation in the South Asian region that maintained full political rights and civil liberties while simultaneously implementing constraints on independent journalism during the period of widespread global health emergency and lockdown measures, did the lowest socioeconomic demographic experience a substantial population expansion?","Yes, the lowest income tier (living on $2 or less daily) expanded by 75 million people during the 2020 global recession.","[""test_001071"", ""test_000552"", ""test_001549""]",India
"Among the mid-2010s years marked by a swift escalation in preference for a visual-first ephemeral communication service among the youth cohort in a dominant North American economic power, did the principal monetary unit of a significant West African state undergo a pronounced downward value trajectory, while simultaneously a maritime Southeast nation with extensive island chains reported a substantial majority of wildfire alerts originating beyond formally allocated land parcels?",Yes,"[""test_001207"", ""test_001945"", ""test_001356""]",2015
"Among members of the demographic cohort between childhood and adulthood in the nation sharing borders with both Canada and Mexico, following a period of significant growth in adoption of a social platform known for ephemeral messaging and disappearing content during the mid-2010s, does the proportion using this platform in the most recent year for which comprehensive survey data was available exceed twice the active user fraction for the same platform observed globally in the late 2010s?","Yes, the 60% usage rate among U.S. teens in 2023 exceeded twice the 24% active user rate observed globally in 2018.","[""test_000602"", ""test_001004"", ""test_001476""]",Snapchat
"Among nations classified as having minimal political liberties during a global health emergency, which also implemented both restrictions on legislative gatherings and prohibitions on public demonstrations, and which were among the major historical contributors to atmospheric carbon accumulation, what was the documented count of decommissioned strategic armaments for that nation in the year the health crisis was declared?",2060,"[""test_000552"", ""test_001072"", ""test_000596"", ""test_000808""]",Russia
"Among nations that were primary contributors to industrial output driving atmospheric changes during the early post-World War II reconstruction phase, maintained the second-largest inventory of deployed strategic deterrence systems in the opening years of the current decade, and were categorized as having constrained civic liberties during the global health crisis, did governing authorities implement limitations on collective citizen gatherings and employ disproportionate enforcement actions?",Yes,"[""test_000596"", ""test_000808"", ""test_000552"", ""test_001071""]",Russia
"Among continental landmasses that established family connections with a Central American territory known for its pre-Columbian civilizations, did regions exhibiting reductions in international child placement also demonstrate modifications in revenue streams from recreational mobility sectors, and what is the relationship with resource conservation metrics?","Yes, the northern continental landmass of the Western Hemisphere experienced a 2 percentage point decline in tourism contribution while maintaining resource conservation metrics of approximately 44.58%.","[""test_001394"", ""test_001039"", ""test_001728""]",North America
"Following a period of heightened social safety net utilization coinciding with a severe global economic contraction (as indicated by a declining trend in welfare program participation concluding at the final recorded data point), did the household debt trajectory relative to disposable income in a continent-sized Southern Hemisphere nation continue its upward shift while residential property transaction volumes in a northeastern state of a transcontinental North American nation remained below the pre-downturn peak level?",Yes,"[""test_000769"", ""test_001301"", ""test_001612""]",Year
"Among nations contributing to international aid at a second-tier level during the four decades prior to the mid-2010s, does the leading donor in that category exhibit a greater share of positive perception toward the legal recognition of same-gender unions than the European country ranking second in contribution volume within the same aid tier?","Yes. The leading second-tier donor (Germany) shows 80% positive perception, while the second-ranked European contributor (United Kingdom) shows 74% positive perception.","[""test_001171"", ""test_001170"", ""test_001914""]",United Kingdom
"Among the primary administrative divisions of a large democracy in South Asia that are not classified as union territories, does the jurisdiction with the highest average daily availability of a dairy product per resident in the most recent biennium also exhibit the highest count of agricultural residue burning incidents during the final year of the preceding decade?","Yes, the northern agricultural jurisdiction shows peak values in both metrics: 1,219 gm/day dairy availability and 102,379 burning incidents.","[""test_001632"", ""test_000489"", ""test_000092""]",Indian States
"Among a major conservative-aligned political faction in a nation with a presidential system that demonstrated the strongest positive perception for a nominee to the nation's highest judicial body during a period of heightened political division, does the faction's attribution of executive accountability for energy cost escalation also represent the dominant response pattern among political groupings in a parallel survey, and does this dominance in response align with the pattern observed among supporters of a regional political coalition in a nation in the southern part of Asia regarding a significant political incident in recent history?","Yes, the major conservative-aligned political faction (Republicans) showed the highest level of blame assignment to the executive branch for fuel price increases (33%) among political factions in the related survey, and the supporters of the regional political coalition (UF Supporters) showed the highest level of denial (63%) for the historical event, confirming both exhibited the dominant response pattern.","[""test_001152"", ""test_001659"", ""test_000040""]",Positive Favorability
